hs6,product_label,years_present,avg_RSCA
293371,"6-Hexanelactam ""epsilon-caprolactam""",12,1.0
290211,Cyclohexane,12,1.0
390140,"Ethylene-alpha-olefin copolymers, having a specific gravity of < 0,94 , in primary forms",7,1.0
390610,"Poly""methyl methacrylate"", in primary forms",11,1.0
320611,Pigments and preparations based on titanium dioxide of a kind used for colouring any material ...,12,1.0
400220,"Butadiene rubber ""BR"", in primary forms or in plates, sheets or strip",12,1.0
400259,"Acrylonitrile-butadiene rubber ""NBR"", in primary forms or in plates, sheets or strip (excl. ...",12,1.0
283620,Disodium carbonate,12,1.0
854229,"Electronic integrated circuits, monolithic, analogue or analogue and digital",5,1.0
292242,Glutamic acid and its salts,12,1.0
871000,"Tanks and other armoured fighting vehicles, motorised, whether or not fitted with weapons, ...",12,1.0
930591,"Parts and accessories of military weapons of heading 9301, n.e.s.",12,1.0
292241,Lysine and its esters; salts thereof,12,1.0
880212,Helicopters of an unladen weight > 2.000 kg (excl. unmanned of heading 8806),6,1.0
381700,Mixed alkylbenzenes and mixed alkylnaphthalenes produced by the alkylation of benzene and naphthalene ...,12,1.0
880230,Aeroplanes and other powered aircraft of an unladen weight > 2.000 kg but <= 15.000 kg (excl. ...,6,1.0
271000,Petroleum oils and oils obtained from bituminous minerals (excluding crude); preparations containing ...,11,1.0
281111,"Hydrogen fluoride ""hydrofluoric acid""",12,1.0
291531,Ethyl acetate,12,1.0
711890,Coin of legal tender,12,1.0
291614,Esters of methacrylic acid,12,1.0
720521,"Powders, of alloy steel (excl. powders of ferro-alloys and radioactive iron powders ""isotopes"")",12,1.0
720529,"Powders, of pig iron, spiegeleisen, iron or non-alloy steel (excl. powders of ferro-alloys ...",12,1.0
732611,"Grinding balls and similar articles for mills, of iron or steel, forged or stamped, but not ...",12,1.0
281129,"Inorganic oxygen compounds of non-metals (excl. diphosphorus pentaoxide, oxides of boron, carbon ...",5,1.0
291736,Terephthalic acid and its salts,12,1.0
550320,"Staple fibres of polyesters, not carded, combed or otherwise processed for spinning",12,1.0
382370,"Fatty alcohols, industrial",12,1.0
283630,"Sodium hydrogencarbonate ""sodium bicarbonate""",12,1.0
320490,"Synthetic organic products of a kind used as luminophores, whether or not chemically defined",11,1.0
270740,Naphthalene containing > 50% of naphthalene (excl. chemically defined),12,1.0
160557,"Abalone, prepared or preserved (excl. smoked)",12,1.0
290960,"Alcohol peroxides, ether peroxides, acetal and hemiacetal peroxides, ketone peroxides and their ...",12,1.0
293361,Melamine,12,1.0
283421,Nitrate of potassium,12,1.0
283325,Sulphates of copper,12,1.0
280470,Phosphorus,12,1.0
550130,"Filament tow as specified in Note 1 to chapter 55, acrylic or modacrylic",12,1.0
790500,"Zinc plates, sheets, strip and foil",12,1.0
810320,"Unwrought tantalum, incl. bars and rods of tantalum obtained simply by sintering; tantalum ...",10,1.0
930190,"Military weapons, incl. sub-machine guns (excl. artillery weapons, rocket launchers, flame-throwers, ...",12,1.0
282612,Fluoride of aluminium,12,1.0
292121,Ethylenediamine and its salts,12,1.0
283010,Sodium sulphides,12,1.0
281000,Oxides of boron; boric acids,12,1.0
720510,"Granules, of pig iron, spiegeleisen, iron or steel (excl. granules of ferro-alloys, turnings ...",12,1.0
291524,Acetic anhydride,12,1.0
291422,Cyclohexanone and methylcyclohexanones,12,1.0
290950,"Ether-phenols, ether-alcohol-phenols and their halogenated, sulphonated, nitrated or nitrosated ...",12,1.0
880510,"Aircraft launching gear and parts thereof, n.e.s. (excl. motor winches for launching gliders); ...",6,1.0
880330,"Parts of aeroplanes or helicopters, n.e.s. (excluding those for gliders)",6,1.0
290391,"Chlorobenzene, o-dichlorobenzene and p-dichlorobenzene",12,1.0
930110,"Artillery weapons ""e.g. guns, howitzers and mortars""",12,1.0
340220,"Surface-active preparations, washing preparations, auxiliary washing preparations and cleaning ...",3,1.0
930120,Rocket launchers; flame-throwers; grenade launchers; torpedo tubes and similar projectors,12,1.0
291816,"Gluconic acid, its salts and esters",12,1.0
290542,Pentaerythritol,12,1.0
130231,"Agar-agar, whether or not modified",12,1.0
811231,"Unwrought hafnium and hafnium waste, scrap and powders (excl. ashes and residues)",3,1.0
880521,Air combat simulators and parts thereof,6,1.0
890610,Warships of all kinds,12,1.0
790400,"Zinc bars, rods, profiles and wire, n.e.s.",12,1.0
290722,"Hydroquinone ""quinol"" and its salts",12,1.0
292310,Choline and its salts,12,1.0
282710,Ammonium chloride,12,1.0
281910,Chromium trioxide,11,1.0
284020,"Borates (excl. disodium tetraborate ""refined borax"")",5,1.0
220290,"Non-alcoholic beverages (excluding water, fruit or vegetable juices and milk)",8,1.0
270791,Creosote oils (excl. chemically defined),12,1.0
291737,Dimethyl terephthalate,12,1.0
290242,m-Xylene,12,1.0
490600,"Plans and drawings for architectural, engineering, industrial, commercial, topographical or ...",12,1.0
284130,Sodium dichromate,12,1.0
283660,Barium carbonate,12,1.0
550120,"Filament tow as specified in Note 1 to chapter 55, of polyesters",12,1.0
290541,"2-Ethyl-2-""hydroxymethyl"" propane-1,3-diol ""trimethylolpropane""",12,1.0
30787,"Smoked, dried, salted or in brine, even in shell, abalone ""Haliotis spp.""",8,1.0
30812,"Frozen sea cucumbers ""Stichopus japonicus, Holothuroidea""",8,1.0
281213,Phosphorus trichloride,8,1.0
281310,Carbon disulphide,12,1.0
30613,"Frozen shrimps and prawns, whether in shell or not, incl. shrimps and prawns in shell, cooked ...",12,1.0
283230,Thiosulphates,12,1.0
282630,"Sodium hexafluoroaluminate ""synthetic cryolite""",12,1.0
382490,"Chemical products and preparations of the chemical or allied industries, incl. those consisting ...",8,1.0
880694,"Unmanned aircraft, with maximum take-off weight > 25 kg but <= 150 kg (excl. for passenger ...",3,1.0
441810,"Windows, French windows and their frames, of wood",3,1.0
290377,"Halogenated derivatives of acyclic hydrocarbons containing two or more different halogens, ...",12,1.0
340211,"Anionic organic surface-active agents, whether or not put up for retail sale (excluding soap)",3,1.0
950320,"Scale model assembly kits, whether or not working models (excluding electric trains, incl. ...",5,1.0
281212,Phosphorus oxychloride,8,1.0
441820,"Doors and their frames and thresholds, of wood",3,1.0
870190,"Tractors (excluding those of heading 8709, pedestrian-controlled tractors, road tractors for ...",8,1.0
382200,"Diagnostic or laboratory reagents on a backing, prepared diagnostic or laboratory reagents ...",3,1.0
690790,"Unglazed ceramic flags and paving, hearth or wall tiles; unglazed ceramic mosaic cubes and ...",8,1.0
940600,"Prefabricated buildings, whether or not complete or already assembled",8,1.0
854914,"Primary cells, primary batteries and electric accumulators: spent goods and waste and scrap, ...",3,1.0
30269,"Fresh or chilled freshwater and saltwater fish (excluding salmonidae, flat fish, tunas, skipjack ...",12,1.0
854260,Hybrid integrated circuits,5,1.0
30784,"Frozen, even in shell, stromboid conchs ""Strombus spp.""",8,1.0
902780,"Instruments and apparatus for physical or chemical analysis, or for measuring or checking viscosity, ...",3,1.0
880390,"Parts of aircraft and spacecraft, n.e.s.",3,1.0
360300,Safety fuses; detonating fuses; percussion or detonating caps; igniters; electric detonators ...,3,1.0
970300,"Original sculptures and statuary, in any material",3,1.0
283020,Zinc sulphide,3,1.0
284520,Boron enriched in boron-10 and its compounds,3,1.0
442190,"Other articles of wood, n.e.s.",8,1.0
293372,"Clobazam ""INN"" and methyprylon ""INN""",12,1.0
620219,"Women's or girls' overcoats, raincoats, car coats, capes, cloaks and similar articles, of textile ...",3,1.0
940540,"Electric lamps and lighting fittings, n.e.s.",3,1.0
290362,"Ethylene dibromide ""ISO"" ""1,2-dibromoethane""",3,1.0
811241,"Unwrought rhenium and rhenium waste, scrap and powders (excl. ashes and residues)",3,1.0
30379,"Frozen freshwater and saltwater fish (excluding salmonidae, flat fish, tunas, skipjack or stripe-bellied ...",12,1.0
846210,"Forging or die-stamping machines, incl. presses, and hammers",3,1.0
300220,Vaccines for human medicine,3,1.0
970110,"Paintings, e.g. oil paintings, watercolours and pastels, and drawings executed entirely by ...",3,1.0
470411,"Unbleached coniferous chemical wood pulp, sulphite (excl. dissolving grades)",12,1.0
261220,Thorium ores and concentrates,12,1.0
292243,Anthranilic acid and its salts,11,1.0
890392,"Motor boats and motor yachts, for pleasure or sports (other than outboard motor boats)",3,1.0
530511,"Coconut ""coir"" fibres, raw",5,1.0
240310,"Smoking tobacco, whether or not containing tobacco substitutes in any proportion",11,1.0
810931,"Zirconium waste and scrap, containing < 1 part hafnium to 500 parts zirconium by weight (excl. ...",3,1.0
30429,Frozen fish fillets (excluding swordfish and toothfish),12,1.0
970521,"Human specimens and parts thereof, as collections or collectors’ pieces of anatomical interest",3,1.0
284030,"Peroxoborates ""perborates""",12,1.0
880310,"Propellers and rotors and parts thereof, for aircraft, n.e.s.",6,1.0
280620,Chlorosulphuric acid,12,1.0
854810,"Waste and scrap of primary cells, primary batteries and electric accumulators; spent primary ...",3,1.0
870831,"Mounted brake linings for tractors, motor vehicles for the transport of ten or more persons, ...",5,1.0
940190,"Parts of seats, n.e.s.",3,1.0
811249,"Articles of rhenium, n.e.s.",3,1.0
292024,Triethyl phosphite,8,1.0
902740,Exposure meters,5,1.0
681390,"Friction material and articles thereof, e.g. sheets, rolls, strips, segments, discs, washers ...",5,1.0
880610,"Unmanned aircraft, designed for the carriage of passengers",3,1.0
620199,"Men's or boys' anoraks, incl. ski jackets, windcheaters, wind-jackets and similar articles ...",3,1.0
340219,"Organic surface-active agents, whether or not put up for retail sale (excluding anionic, cationic ...",3,1.0
292021,Dimethyl phosphite,8,1.0
390760,"Poly""ethylene terephthalate"", in primary forms",8,1.0
940510,Chandeliers and other electric ceiling or wall lighting fittings (excluding for lighting public ...,3,1.0
851722,Teleprinters for line telegraphy,5,1.0
293944,Norephedrine and its salts,9,1.0
293334,"Fentanyls and their derivatives, with nitrogen hetero-atom[s] only, containing an unfused pyridine ...",3,1.0
10612,"Live whales, dolphins and porpoises (mammals of the order Cetacea); manatees and dugongs (mammals ...",12,1.0
940560,"Illuminated signs, illuminated nameplates and the like, with a permanently fixed light source",3,1.0
570320,"Carpets and other floor coverings, of nylon or other polyamides, tufted ""needle punched"", whether ...",3,1.0
291431,"Phenylacetone ""phenylpropan-2-one""",6,1.0
690890,"Glazed ceramic flags and paving, hearth or wall tiles; glazed ceramic mosaic cubes and the ...",8,1.0
293972,"Cocaine, ecgonine; salts, esters and other derivatives thereof",3,1.0
940390,"Parts of furniture, n.e.s. (excluding of seats and medical, surgical, dental or veterinary ...",3,1.0
80300,"Bananas, incl. plantains, fresh or dried",12,1.0
281217,Thionyl chloride,8,1.0
291817,"2,2-Diphenyl-2-hydroxyacetic acid ""benzilic acid""",7,1.0
890391,"Sailboats and yachts, with or without auxiliary motor, for pleasure or sports",3,1.0
300230,Vaccines for veterinary medicine,3,1.0
880320,"Under-carriages and parts thereof, for aircraft, n.e.s.",3,1.0
300219,"Immunological products, n.e.s. (code possibly empty, preceding subheadings seem exhaustive)",3,1.0
390720,"Polyethers, in primary forms (excluding polyacetals and goods of 3002 10)",3,1.0
30782,"Live, fresh or chilled, even in shell, stromboid conchs ""Strombus spp.""",8,1.0
121210,"Locust beans, incl. locust bean seed, fresh, chilled, frozen or dried, whether or not ground",3,1.0
20850,"Fresh, chilled or frozen meat and edible offal of reptiles ""e.g. snakes, turtles, crocodiles""",12,1.0
293492,"Fentanyls and their derivatives (excl. with nitrogen hetero-atom[s] only, and products of 2934.91)",3,1.0
293154,"Trichlorfon ""ISO""",3,1.0
293133,Diethyl ethylphosphonate,5,1.0
846021,"Grinding machines, for working metal, in which the positioning in any one axis can be set up ...",4,1.0
441890,"Builders' joinery and carpentry, of wood, incl. cellular wood panels (excluding windows, French ...",8,1.0
283610,Commercial ammonium carbonate and other ammonium carbonates,4,1.0
950890,"Roundabouts, swings, shooting galleries and other fairground amusements; travelling theatres ...",3,1.0
930590,"Parts and accessories for weapons and the like of headings 9301, 9303 or 9304, n.e.s.",10,1.0
950299,"Parts and accessories for dolls representing only human beings, n.e.s.",5,1.0
292425,"Alachlor ""ISO""",7,1.0
120720,"Cotton seeds, whether or not broken",9,1.0
300210,"Antisera and other blood fractions and immunological products, whether or not modified or obtained ...",8,1.0
290392,"Hexachlorobenzene (ISO) and DDT (ISO) (clofenotane (INN), 1,1,1-trichloro-2,2-bis(p-chloro ...",12,1.0
281215,Sulphur monochloride,8,1.0
80290,"Nuts, fresh or dried, whether or not shelled or peeled (excluding coconuts, Brazil nuts, cashew ...",3,1.0
130214,Saps and extracts of ephedra,7,1.0
293337,"N-Phenethyl-4-piperidone ""NPP""",3,1.0
293971,"Cocaine, ecgonine, levometamfetamine, metamfetamine ""INN"", metamfetamine racemate, and salts, ...",5,1.0
530590,"Ramie and other vegetable textile fibres, n.e.s., raw or processed, but not spun; tow, noils ...",5,1.0
940130,"Swivel seats with variable height adjustments (excluding medical, surgical, dental or veterinary, ...",3,1.0
70990,"Fresh or chilled vegetables (excluding potatoes, tomatoes, vegetables of the Allium spp., cabbages ...",12,1.0
441860,"Posts and beams, of wood",3,1.0
292214,"Dextropropoxyphene ""INN"" and its salts",9,1.0
292022,Diethyl phosphite,8,1.0
440920,"Wood, incl. strips and friezes for parquet flooring, not assembled, continuously shaped ""tongued, ...",10,1.0
940140,"Seats, convertible into beds (excluding garden seats and camping equipment, and medical, dental ...",3,1.0
681510,"Articles of graphite or other carbon, incl. carbon fibres, for non-electrical purposes",3,1.0
340213,"Non-ionic organic surface-active agents, whether or not put up for retail sale (excluding soap)",3,1.0
660310,"Handles and knobs for umbrellas and sun umbrellas of heading 6601 or for walking-sticks, seat-sticks, ...",4,1.0
970190,Collages and similar decorative plaques,3,1.0
382711,"Mixtures containing chlorofluorocarbons ""CFCs"", whether or not containing hydrochlorofluorocarbons ...",3,1.0
690810,"Glazed ceramic tiles, mosaic cubes and similar articles, whether or not square or rectangular, ...",8,1.0
620213,"Women's or girls' overcoats, raincoats, car coats, capes, cloaks and similar articles, of man-made ...",3,1.0
292114,"2-(N,N-Diisopropylamino)ethylchloride hydrochloride",8,1.0
890310,Inflatable vessels for pleasure or sports,3,1.0
293142,Dimethyl propylphosphonate,3,1.0
701939,"Webs, mattresses, boards and similar nonwoven products, of glass fibres (excluding mats and ...",3,1.0
251622,"Sandstone, merely cut, by sawing or otherwise, into blocks or slabs of a square or rectangular ...",6,1.0
741999,"Articles of copper, n.e.s.",3,1.0
90930,Cumin seeds,10,1.0
440724,"Virola, mahogany ""Swietenia spp."", imbuia and balsa, sawn or chipped lengthwise, sliced or ...",5,1.0
940520,"Electric table, desk, bedside or floor-standing lamps",3,1.0
293132,Dimethyl propylphosphonate,4,1.0
570330,"Carpets and other floor coverings, of man-made textile materials, tufted ""needle punched"", ...",3,1.0
284450,"Spent ""irradiated"" fuel elements ""cartridges"" of nuclear reactors [Euratom]",10,1.0
460191,"Plaits and similar products of plaiting materials, whether or not assembled into strips; plaiting ...",5,1.0
120100,"Soya beans, whether or not broken",10,1.0
293143,Diethyl ethylphosphonate,3,1.0
60310,"Fresh cut flowers and flower buds, for bouquets or for ornamental purposes",7,1.0
911420,Jewels for clocks or watches (excluding gems for clock and watch cases),5,1.0
620119,"Men's or boys' overcoats, raincoats, car coats, capes, cloaks and similar articles, of textile ...",3,1.0
293355,"Loprazolam ""INN"", mecloqualone ""INN"", methaqualone ""INN"" and zipeprol ""INN"", and salts thereof",12,1.0
850530,Electro-magnetic lifting heads,5,1.0
530519,"Coconut ""coir"" fibres, processed but not spun; tow, noils and waste of such fibres, incl. yarn ...",5,1.0
401199,"Pneumatic tyres, new, of rubber (excluding having a ""herring-bone"" or similar tread and pneumatic ...",8,1.0
283800,"Fulminates, cyanates and thiocyanates",4,1.0
900912,"Electrostatic photocopying apparatus, operating by reproducing the original image via an intermediate ...",4,1.0
293335,3-Quinuclidinol,3,1.0
30788,"Smoked, dried, salted or in brine, even in shell, stromboid conchs ""Strombus spp.""",8,1.0
382478,"Mixtures containing perfluorocarbons ""PFCs"" or hydrofluorocarbons ""HFCs"", but not containing ...",3,1.0
292330,Tetraethylammonium perfluorooctane sulphonate,6,1.0
293943,"Cathine ""INN"" and its salts",12,1.0
410129,"Raw hides and skins of bovine animals, fresh or wet-salted, whether or not dehaired or split ...",3,1.0
482360,"Trays, dishes, plates, cups and the like, of paper or paperboard",5,1.0
441900,"Tableware and kitchenware, of wood (excluding interior fittings, ornaments, cooperage products, ...",8,1.0
610321,"Men's or boys' ensembles of wool or fine animal hair, knitted or crocheted (excluding ski ensembles ...",5,1.0
40700,"Birds' eggs, in shell, fresh, preserved or cooked",12,1.0
293963,Lysergic acid and its salts,11,1.0
150910,Virgin olive oil and its fractions obtained from the fruit of the olive tree solely by mechanical ...,3,1.0
290393,"Pentachlorobenzene ""ISO""",8,1.0
811213,Beryllium waste and scrap (excl. ashes and residues containing beryllium),10,1.0
292423,"2-Acetamidobenzoic acid ""N-acetylanthranilic acid"" and its salts",11,1.0
281112,"Hydrogen cyanide ""hydrocyanic acid""",4,1.0
293961,"Ergometrine ""INN"" and its salts",12,1.0
610421,"Women's or girls' ensembles of wool or fine animal hair, knitted or crocheted (excluding ski ...",5,1.0
620112,"Men's or boys' overcoats, raincoats, car coats, capes, cloaks and similar articles, of cotton ...",3,1.0
380840,Disinfectants put up for retail sale or as preparations or articles,7,1.0
380810,Insecticides put up for retail sale or as preparations or articles,8,1.0
290375,Dichloropentafluoropropanes,12,1.0
100110,Durum wheat,8,1.0
300343,"Medicaments containing norephedrine or its salts, not containing hormones, steroids used as ...",5,1.0
441129,"Fibreboard of wood or other ligneous materials, whether or not agglomerated with resins or ...",4,1.0
880710,"Propellers and rotors and parts thereof, for aircraft, n.e.s.",4,1.0
620113,"Men's or boys' overcoats, raincoats, car coats, capes, cloaks and similar articles, of man-made ...",3,1.0
442010,"Statuettes and other ornaments, of wood (excluding wood marquetry and inlaid wood)",3,1.0
842481,"Agricultural or horticultural mechanical appliances, whether or not hand-operated, for projecting, ...",8,1.0
10633,"Live ostriches, and emus [Dromaius novaehollandiae]",11,1.0
490599,"Maps and hydrographic or similar charts of all kinds, incl. atlases, wall maps and topographical ...",3,1.0
851750,"Apparatus for carrier-current line systems or digital line systems, for line telephony or line ...",6,1.0
551413,"Woven fabrics containing predominantly, but < 85% polyester staple fibres by weight, mixed ...",3,1.0
292412,"Fluoroacetamide ""ISO"", monocrotophos ""ISO"" and phosphamidon ""ISO""",11,1.0
300440,"Medicaments containing alkaloids or derivatives thereof, not containing hormones, steroids ...",8,1.0
262021,"Leaded gasoline sludges and leaded anti-knock compound sludges, obtained from storage tanks ...",9,1.0
293341,"Levorphanol ""INN"" and its salts",12,1.0
30371,"Frozen sardines Sardina pilchardus, Sardinops spp."", sardinella ""Sardinella spp."" and brisling ...",10,1.0
610110,"Overcoats, car-coats, capes, cloaks, anoraks, incl. ski-jackets, wind-cheaters, wind-jackets ...",4,1.0
290339,"Fluorinated, brominated or iodinated derivatives of acyclic hydrocarbons (excluding ethylene ...",3,1.0
100840,"Fonio ""Digitaria spp.""",5,1.0
442199,"Articles of wood, n.e.s.",3,1.0
292112,"2-""N,N-Dimethylamino""ethylchloride hydrochloride",9,1.0
284530,Lithium enriched in lithium-6 and its compounds,3,1.0
610412,"Women's or girls' suits of cotton, knitted or crocheted (excluding ski overalls and swimwear)",6,1.0
281216,Sulphur dichloride,8,1.0
846291,"Hydraulic presses for working metal (excluding forging, bending, folding, straightening and ...",3,1.0
846299,"Presses, not hydraulic, for working metal (excluding forging, bending, folding, straightening ...",3,1.0
281214,Phosphorus pentachloride,8,1.0
710820,Monetary gold,12,1.0
530529,"Abaca ""Manila hemp or Musa textilis Nee"", processed but not spun; tow, noils and waste of these ...",4,1.0
292218,"2-""N,N-Diisopropylamino""ethanol",6,1.0
441232,"Plywood consisting solely of sheets of wood <= 6 mm thick, with at least one outer ply of non-coniferous ...",8,1.0
290381,"1,2,3,4,5,6-Hexachlorocyclohexane (HCH (ISO)), including lindane (ISO, INN)",12,1.0
600531,"Unbleached or bleached warp knit fabrics of synthetic fibres ""incl. those made on galloon knitting ...",5,1.0
292213,Triethanolamine and its salts,7,1.0
940381,"Furniture of bamboo or rattan (excluding seats and medical, surgical, dental or veterinary ...",8,1.0
382479,"Mixtures containing halogenated derivatives of methane, ethane or propane (excluding those ...",3,1.0
293520,N-Ethylperfluorooctane sulphonamide,7,1.0
30490,"Frozen fish meat, whether or not minced (excluding fillets)",6,1.0
852851,Monitors of a kind solely or principally used in an automatic data-processing machine of heading ...,8,1.0
441400,"Wooden frames for paintings, photographs, mirrors or similar objects",3,1.0
293060,"2-(N,N-Diethylamino)ethanethiol",8,1.0
481410,'Ingrain' paper,5,1.0
761519,"Table, kitchen or other household articles, parts thereof, of aluminium (excluding pot scourers ...",12,1.0
620111,"Men's or boys' overcoats, raincoats, car coats, capes, cloaks and similar articles, of wool ...",3,1.0
30629,"Crustaceans, even smoked, fit for human consumption, whether in shell or not, live, fresh, ...",8,1.0
940399,"Parts of furniture, not of wood, n.e.s. (excl. of seats or medical, surgical, dental or veterinary ...",3,1.0
701200,Glass inners for vacuum flasks or for other vacuum vessels,4,1.0
293945,"Levometamfetamine, metamfetamine ""INN"", metamfetamine racemate and their salts",3,1.0
851410,Resistance heated industrial or laboratory furnaces and ovens (excluding drying ovens),3,1.0
621141,"Women's or girls' tracksuits and other garments, n.e.s. of wool or fine animal hair (excluding ...",5,1.0
30419,"Fresh or chilled fillets and other fish meat whether or not minced"" (excluding swordfish and ...",11,1.0
300680,Waste pharmaceuticals,4,1.0
80520,"Fresh or dried mandarins incl. tangerines and satsumas, clementines, wilkings and similar citrus ...",8,1.0
852520,"Transmission apparatus incorporating reception apparatus, for radio-telephony, radio-telegraphy, ...",8,1.0
381230,Anti-oxidising preparations and other compound stabilisers for rubber or plastics,8,1.0
151000,"Other oils and their fractions, obtained solely from olives, whether or not refined, but not ...",3,1.0
441031,"Particle board and similar board, of wood, whether or not agglomerated with resins or other ...",3,1.0
293292,"1-""1,3-Benzodioxol-5-yl""propan-2-one",10,1.0
293148,"3,9-Dimethyl-2,4,8,10-tetraoxa-3,9-diphosphaspiro[5.5] undecane 3,9-dioxide",3,1.0
382713,Mixtures containing carbon tetrachloride,3,1.0
30376,Frozen eels (Anguilla spp.),5,1.0
100190,Wheat and meslin (excluding durum wheat),12,1.0
170111,Raw cane sugar (excluding added flavouring or colouring),12,1.0
481430,"Wallpaper and similar wall coverings of paper, consisting of paper covered, on the face side, ...",5,1.0
540243,"Filament yarn of polyester, incl. monofilament of < 67 decitex, single, untwisted or with a ...",5,1.0
845940,Boring machines for metals (excluding way-type unit head machines and boring-milling machines),6,1.0
382712,"Mixtures containing hydrobromofluorocarbons ""HBFCs""",3,1.0
30374,"Frozen mackerel (Scomber scombrus, Scomber australasicus, Scomber japonicus)",11,1.0
200980,"Juice of fruit or vegetables, unfermented, whether or not containing added sugar or other sweetening ...",12,1.0
811252,Thallium waste and scrap (excl. ashes and residues containing thallium),11,1.0
600532,"Dyed warp knit fabrics of synthetic fibres ""incl. those made on galloon knitting machines"", ...",6,1.0
251621,"Sandstone, crude or roughly trimmed (excluding already with the characteristics of setts, curbstones ...",3,1.0
382499,"Chemical products and preparations of the chemical or allied industries, incl. those consisting ...",3,1.0
640191,"Waterproof footwear covering the knee, with outer soles and uppers of rubber or of plastics, ...",4,1.0
291616,Binapacryl (ISO),11,1.0
292030,"Endosulfan ""ISO""",8,1.0
252810,"Sodium borates, natural, and concentrates thereof, whether or not calcined (excluding sodium ...",3,1.0
481840,"Sanitary towels and tampons, napkins and napkin for babies and similar sanitary articles, of ...",12,1.0
